pmid,title,summary,keywords,score,theme_rule,cluster
PMC10000043,,"Animals : an Open Access Journal from MDPI 2076-2615 MDPI 10.3390/ani13050892 animals-13-00892 Article Immunological and Oxidative Biomarkers in Bovine Serum from Healthy, Clinical, and Sub-Clinical Mastitis Caused by Escherichia coli and Staphylococcus aureus Infection","['mansoura', 'clinical', 'egypt', 'writing', 'majmaah', 'mastitis']",0.25557100772857666,Other,0
PMC10000007,,"ARTICLE II. A PAPER ON EPIDEMICS. By H. NANCE, M.D., Kewanee, Ill. Read to the Military Tract Medical Society. Having been selected by...","['epidemics', 'fever', 'county', 'typhoid', 'community', 'good']",0.2406770884990692,Other,1
PMC10000048,,Animals: an Open Access Journal from MDPI 2076-2615 MDPI 10.3390/ani13050805 animals-13-00805 Editorial: Role of Non-Coding RNAs in Animals,"['et', 'ncrnas', 'lncrnas', 'al', 'roles', 'regulation']",0.2237662822008133,Other,0
PMC10000010,,"QUINCY MEDICAL SOCIETY. The semi-annual meeting of the Quincy Medical Society was held-at the office of Dr. Zimmermann, in Quincy, Nov. 18th, 1866","['president', 'meeting', 'annual', 'quincy', 'society', 'dr']",0.2000018060207367,Other,2
PMC10000017,,Revista Brasileira de Epidemiology 1415-790X 1980-5497 Associaço Brasilleira de Sade Coletiva 10.1590/1980-539720230020 00419 Original Article Difficulties in the use of medications by elderly people followed up in a cohort study in Southern Brazil Dificultades no uso de medicamentos por idosos acompanhados em una coorte do Sul do Brasilia,"['escrita', 'pelotas', 'metodologia', 'revisão', 'edição', 'validação']",0.16839763522148132,Clinical Trial,3
